{"compatibility":{"adapter_version":"1.0","legacy_output_preserved":false,"legacy_validators_preserved":true,"source_contract":"semantic-change-controls-v1"},"controls":[{"confidence":{"basis":"determinability-freshness-provenance-v1","cap":100,"components":{"determinability":60,"freshness":25,"provenance":15},"level":"HIGH","value":100},"control_id":"monitoring-plan","evidence":{"collected_at":"2026-09-03T12:00:00Z","effective_valid_until":"2026-09-03T13:00:00Z","hash":{"algorithm":"sha256","value":"aaaaaaaaaaaaaaaaaaaaaaaaaaaaaaaaaaaaaaaaaaaaaaaaaaaaaaaaaaaaaaaa"},"parser_status":"OK","provider_status":"AVAILABLE","source":"change-request-validator","valid_until":"2026-09-03T13:00:00Z"},"execution_id":"urn:preflightops:semantic-control:sha256:febd089aa0d468e863d078e61d9a91a71ac139015df26ba0d1b32f947826d45c","freshness":"FRESH","issues":[],"status":"PASS"},{"confidence":{"basis":"determinability-freshness-provenance-v1","cap":100,"components":{"determinability":60,"freshness":25,"provenance":15},"level":"HIGH","value":100},"control_id":"rollback-plan","evidence":{"collected_at":"2026-09-03T12:00:00Z","effective_valid_until":"2026-09-03T13:00:00Z","hash":{"algorithm":"sha256","value":"aaaaaaaaaaaaaaaaaaaaaaaaaaaaaaaaaaaaaaaaaaaaaaaaaaaaaaaaaaaaaaaa"},"parser_status":"OK","provider_status":"AVAILABLE","source":"change-request-validator","valid_until":"2026-09-03T13:00:00Z"},"execution_id":"urn:preflightops:semantic-control:sha256:b8c8ccc9e61c85405d000f9130e25505ebaa5348c0f42c734415ba9e12d55823","freshness":"FRESH","issues":[],"status":"PASS"},{"confidence":{"basis":"determinability-freshness-provenance-v1","cap":100,"components":{"determinability":60,"freshness":25,"provenance":15},"level":"HIGH","value":100},"control_id":"validation-plan","evidence":{"collected_at":"2026-09-03T12:00:00Z","effective_valid_until":"2026-09-03T13:00:00Z","hash":{"algorithm":"sha256","value":"aaaaaaaaaaaaaaaaaaaaaaaaaaaaaaaaaaaaaaaaaaaaaaaaaaaaaaaaaaaaaaaa"},"parser_status":"OK","provider_status":"AVAILABLE","source":"change-request-validator","valid_until":"2026-09-03T13:00:00Z"},"execution_id":"urn:preflightops:semantic-control:sha256:05140865101cda437177bdc9ced6e58a7c824a97518a4f4c15895fb53c677351","freshness":"FRESH","issues":[],"status":"PASS"}],"data":{"classification":"internal","content_embedded":false,"metadata_profile":"preflightops-semantic-metadata-v1"},"evaluated_at":"2026-09-03T12:30:00Z","integrity":{"algorithm":"sha256","canonicalization":"preflightops-canonical-json-v1","value":"62e19deb40208a028301286837002b87488f1f49b233c66cb47d16276fade957"},"policy":{"confidence_basis":"determinability-freshness-provenance-v1","max_age_seconds":3600,"name":"preflightops-semantic-validation","version":"1.0"},"schema_version":"1.0","semantic_validation_id":"urn:preflightops:semantic-validation:sha256:62e19deb40208a028301286837002b87488f1f49b233c66cb47d16276fade957","summary":{"confidence":{"basis":"determinability-freshness-provenance-v1","level":"HIGH","value":100},"counts":{"ERROR":0,"FAIL":0,"NOT_APPLICABLE":0,"PASS":3,"UNKNOWN":0},"status":"PASS"}}
